image_id,original_caption,BLIP_caption,GIT_caption,VIT-GPT2_caption,BLIP-Large_caption,voted_adjectives
image_94,"Busy, beautiful, mountain architecture marks the skyline of a bustling city.",a cityscape with buildings and mountains in the background,digital art selected for the #,a series of photos of a city with a bunch of buildings ,a close up of a city with mountains and buildings in the background,[]
image_95,"A cluster of busy, mountain, rugged, tall houses sits atop a steep cliff by the ocean.",a painting of a town on the coast,a painting of a town,a scenic view of a river with a large body of water ,a close up of a painting of a town on a cliff,[]
image_96,"Natural, small, bright wildflowers bloom in a meadow under a bright sky.",a field of wildflowers with the sun shining through the clouds,wild flowers in the field,a flowery field with a bunch of flowers in it ,a close up of a field of flowers with the sun in the background,[]
image_97,"Bright, modern, small architecture marks the skyline of a bustling city.",a cityscape with many buildings and buildings,a city with a lot of buildings,a row of ties on a table ,a close up of a city with many buildings and a street,['many']
image_98,"Sleek, mountain, rugged architecture marks the skyline of a bustling city.","the futuristic city of santiago, chile",the building is futuristic,a city with a lot of buildings and mountains ,a rendering of a futuristic city with a mountain in the background,['futuristic']
image_99,"Bold, natural, bright trees sway gently in the cool autumn breeze.",a forest with colorful trees and leaves,the leaves are red,a forest filled with trees and trees with a sky background ,a view of a forest with lots of trees with orange and yellow leaves,[]
